{
  "calendar_id": "CN-national-2026-gov-office-2025-7",
  "coverage_start": "2026-01-01",
  "coverage_end": "2026-12-31",
  "complete": true,
  "non_working_dates": [
    "2026-01-01",
    "2026-01-02",
    "2026-01-03",
    "2026-02-15",
    "2026-02-16",
    "2026-02-17",
    "2026-02-18",
    "2026-02-19",
    "2026-02-20",
    "2026-02-21",
    "2026-02-22",
    "2026-02-23",
    "2026-04-04",
    "2026-04-05",
    "2026-04-06",
    "2026-05-01",
    "2026-05-02",
    "2026-05-03",
    "2026-05-04",
    "2026-05-05",
    "2026-06-19",
    "2026-06-20",
    "2026-06-21",
    "2026-09-25",
    "2026-09-26",
    "2026-09-27",
    "2026-10-01",
    "2026-10-02",
    "2026-10-03",
    "2026-10-04",
    "2026-10-05",
    "2026-10-06",
    "2026-10-07"
  ],
  "working_weekend_dates": [
    "2026-01-04",
    "2026-02-14",
    "2026-02-28",
    "2026-05-09",
    "2026-09-20",
    "2026-10-10"
  ],
  "source_url": "https://www.gov.cn/zhengce/zhengceku/202511/content_7047091.htm",
  "verified_at": "2026-08-12"
}
